{
  "payload": {
    "contractVersion": "host-guard/5.0.0-rc.2",
    "commandId": "00000000-0000-4000-8000-000000000010",
    "actionId": "00000000-0000-4000-8000-000000000011",
    "executorId": "00000000-0000-4000-8000-000000000012",
    "assetId": "00000000-0000-4000-8000-000000000002",
    "sensorId": "00000000-0000-4000-8000-000000000003",
    "bootId": "00000000-0000-4000-8000-000000000004",
    "captureScopeId": "00000000-0000-4000-8000-000000000005",
    "targetRef": "00000000-0000-4000-8000-000000000013",
    "peerKey": "0000000000000000000000000000000000000000000000000000000000000000",
    "keyEpoch": 1,
    "environment": "lab",
    "actionType": "temporary_block",
    "scope": "peer_service",
    "addressFamily": "ipv4",
    "direction": "outbound",
    "transport": "tcp",
    "servicePort": 443,
    "capabilityId": "00000000-0000-4000-8000-000000000009",
    "bundleId": "00000000-0000-4000-8000-000000000014",
    "policySha256": "0000000000000000000000000000000000000000000000000000000000000000",
    "evidenceSha256": "0000000000000000000000000000000000000000000000000000000000000000",
    "authorizationId": "00000000-0000-4000-8000-000000000015",
    "authorizationRevision": 1,
    "issuedAt": "2026-10-03T00:00:02Z",
    "applyBy": "2026-10-03T00:00:07Z",
    "leaseExpiresAt": "2026-10-03T00:00:32Z",
    "blockUntil": "2026-10-03T00:00:32Z",
    "idempotencyKey": "00000000-0000-4000-8000-000000000011",
    "executorBootId": "00000000-0000-4000-8000-000000000018"
  },
  "keyId": "example-not-trusted",
  "algorithm": "Ed25519",
  "signature": "AAAAAAAAAAAAAAAAAAAAAAAAAAAAAAAAAAAAAAAAAAAAAAAAAAAAAAAAAAAAAAAAAAAAAAAAAAAAAAAAAAAAAA"
}
